{
  "id": "plausible",
  "name": "Plausible Analytics",
  "domain": "plausible.io",
  "category": "analytics",
  "price_usd_mo": 9,
  "price_plan": "Starter",
  "price_unit": "flat",
  "price_source": "https://plausible.io/#pricing",
  "price_checked": "2026-08-05",
  "jobs": [
    "privacy-friendly web analytics",
    "goals & custom events",
    "no pageview caps",
    "email/Slack reports"
  ],
  "verdict": "YES",
  "verdict_reason": "The SaaS and the self-host are the same software — the Community Edition removes the pageview cap and the invoice at once. Margin is thinner than it looks: ClickHouse wants real RAM.",
  "what_you_lose": [
    "Their infrastructure absorbing traffic spikes — a front-page day is now your ClickHouse's problem",
    "Funding the developers whose code you're running (their pricing page will tell you the same, correctly)",
    "Managed email reports and uptime — small, but it's on your pager now"
  ],
  "alternatives": ["plausible", "umami"],
  "economics": {
    "vps_share_usd_mo": 2.5,
    "storage_usd_mo": 0,
    "maint_min_mo": 15
  },
  "hardware_tier": "vps",
  "provenance": {
    "capability_seed": "caniselfhostit",
    "decision_layer": "original"
  },
  "verified": {
    "by": "tier3-bot",
    "at": "2026-10-02",
    "protocol": "v1",
    "setup_min": 40,
    "assistant": "claude-code",
    "evidence": ["logs/plausible-plausible.md", "compose/plausible-plausible.yml"],
    "what_broke": [
      "CE images live on ghcr.io, not Docker Hub — networks that only mirror Docker Hub (ours, during initial verification) can't pull them; full workflow manually verified in this re-check",
      "First boot must run createdb + migrate before serve — the compose command handles it, but a bare `run` exits confusingly",
      "2026-10-02 re-check: ClickHouse 24.12-alpine now disables HTTP access for the default user when no credentials are set — fixed by adding CLICKHOUSE_USER/PASSWORD to the compose and threading the credentials through CLICKHOUSE_DATABASE_URL",
      "2026-10-02 re-check: the original health check used `localhost` which Alpine resolves to ::1 (IPv6) but Phoenix binds to 0.0.0.0 (IPv4) — fixed by using 127.0.0.1 explicitly; also switched from /api/health (returns 503 until ClickHouse credentials are wired) to a static file check"
    ]
  },
  "compose": "compose/plausible-plausible.yml",
  "links": {
    "caniselfhostit": "https://caniselfhostit.com/plausible"
  }
}
