{
  "id": "matomo-cloud",
  "name": "Matomo Cloud",
  "domain": "matomo.org",
  "category": "analytics",
  "price_usd_mo": 26,
  "price_plan": "Business · 50,000 hits/month",
  "price_unit": "usage",
  "price_source": "https://matomo.org/pricing/",
  "price_checked": "2026-08-06",
  "links": {
    "caniselfhostit": "https://caniselfhostit.com/matomo-cloud"
  },
  "jobs": [
    "web analytics",
    "goals & funnels",
    "visitor logs",
    "GDPR-friendly tracking"
  ],
  "verdict": "YES",
  "alternatives": [
    "matomo",
    "plausible"
  ],
  "provenance": {
    "capability_seed": "caniselfhostit",
    "decision_layer": "original"
  },
  "verdict_reason": "It is literally the same software. Matomo Cloud charges $26/mo to run the GPL code they publish; the apache image plus MariaDB is a one-evening setup and the data lands in your database instead of theirs.",
  "what_you_lose": [
    "Managed upgrades and their support SLA",
    "Cloud-side raw data retention policies become your storage problem"
  ],
  "economics": {
    "vps_share_usd_mo": 1.0,
    "storage_usd_mo": 0,
    "maint_min_mo": 30
  },
  "hardware_tier": "vps",
  "verified": {
    "by": "zernonia",
    "at": "2026-08-10",
    "protocol": "v1",
    "setup_min": 31,
    "assistant": "claude-code",
    "evidence": [
      "logs/matomo-cloud.md",
      "compose/matomo-cloud-matomo.yml"
    ],
    "what_broke": [
      "Boot to healthy measured at 39s on the 2GB reference env"
    ]
  },
  "compose": "compose/matomo-cloud-matomo.yml"
}
