{
  "id": "tooljet-cloud",
  "name": "ToolJet",
  "domain": "tooljet.com",
  "category": "automation-dev",
  "price_usd_mo": 79,
  "price_plan": "Pro",
  "price_unit": "per-seat",
  "price_source": "https://www.tooljet.ai/pricing",
  "price_checked": "2026-08-07",
  "links": {
    "caniselfhostit": "https://caniselfhostit.com/tooljet-cloud"
  },
  "jobs": [
    "internal tool builder",
    "data source connectors",
    "app sharing",
    "queries & workflows"
  ],
  "verdict": "YES",
  "alternatives": [
    "tooljet",
    "appsmith"
  ],
  "provenance": {
    "capability_seed": "caniselfhostit",
    "decision_layer": "original"
  },
  "verdict_reason": "ToolJet publishes the software; the cloud plan charges $79/mo to run it for you. Run the community edition — or Appsmith, same category, whose boot we verified — and keep the builder seats free.",
  "what_you_lose": [
    "Managed upgrades and cloud-plan support",
    "Some enterprise connectors are license-gated in CE"
  ],
  "economics": {
    "vps_share_usd_mo": 2.0,
    "storage_usd_mo": 0,
    "maint_min_mo": 30
  },
  "hardware_tier": "vps",
  "verified": {
    "by": "zernonia",
    "at": "2026-08-10",
    "protocol": "v1",
    "setup_min": 33,
    "assistant": "claude-code",
    "evidence": [
      "logs/tooljet-cloud.md",
      "compose/retool-appsmith.yml"
    ]
  },
  "compose": "compose/retool-appsmith.yml"
}
