{
  "id": "adobe-acrobat",
  "name": "Adobe Acrobat",
  "domain": "adobe.com",
  "category": "files-docs",
  "price_usd_mo": 24.99,
  "price_plan": "Acrobat Standard",
  "price_unit": "flat",
  "price_source": "https://www.adobe.com/acrobat/pricing.html",
  "price_checked": "2026-08-05",
  "links": {
    "caniselfhostit": "https://caniselfhostit.com/adobe-acrobat"
  },
  "jobs": [
    "PDF editing",
    "merge/split/compress",
    "OCR",
    "fill & sign"
  ],
  "verdict": "YES",
  "alternatives": [
    "stirling-pdf"
  ],
  "provenance": {
    "capability_seed": "caniselfhostit",
    "decision_layer": "original"
  },
  "verdict_reason": "Stirling-PDF is the whole Acrobat toolbox — merge, split, OCR, compress, redact, sign — behind one port, with no Adobe account and no telemetry. It booted healthy in under two minutes.",
  "what_you_lose": [
    "Acrobat's collaborative review flows and cloud sync",
    "The genuinely better mobile scanning apps"
  ],
  "economics": {
    "vps_share_usd_mo": 0.5,
    "storage_usd_mo": 0,
    "maint_min_mo": 10
  },
  "hardware_tier": "vps",
  "verified": {
    "by": "tier3-bot",
    "at": "2026-09-24",
    "protocol": "v1",
    "setup_min": 1,
    "assistant": "claude-code",
    "evidence": [
      "logs/adobe-acrobat.md",
      "compose/adobe-acrobat-stirling-pdf.yml"
    ],
    "what_broke": [
      "Boot to healthy: 48s on the 2GB reference env (v2.14.3, down from 72s in Aug; last commit 2026-09-23 — project is extremely active with 92K stars)"
    ]
  },
  "compose": "compose/adobe-acrobat-stirling-pdf.yml"
}
