{
  "id": "backblaze-personal-backup",
  "name": "Backblaze Personal Backup",
  "domain": "backblaze.com",
  "category": "backup",
  "price_usd_mo": 8.25,
  "price_plan": "Personal Backup (annual)",
  "price_unit": "flat",
  "price_source": "https://www.backblaze.com/cloud-backup/pricing",
  "price_checked": "2026-08-05",
  "jobs": [
    "unattended whole-computer backup",
    "unlimited offsite storage",
    "versioning & point-in-time restore",
    "restore by mail (they ship you a drive)"
  ],
  "verdict": "NOT_REALLY",
  "verdict_reason": "Backrest + restic is excellent software, but 'offsite' means renting storage anyway — and your backup of last resort should not depend on a server you also administer. The math never breaks even; the failure mode is losing everything twice.",
  "what_you_lose": [
    "'Unlimited': B2/S3-class storage for a 2TB machine costs more than the whole subscription",
    "Restore-by-mail when your house burns down with the NAS in it",
    "The property that saves you: your backup working does not depend on you having done maintenance"
  ],
  "alternatives": ["backrest"],
  "economics": {
    "vps_share_usd_mo": 0.3,
    "storage_usd_mo": 6,
    "maint_min_mo": 30
  },
  "hardware_tier": "pi",
  "provenance": {
    "capability_seed": "caniselfhostit",
    "decision_layer": "original"
  },
  "verified": {
    "by": "zernonia",
    "at": "2026-08-10",
    "protocol": "v1",
    "setup_min": 45,
    "assistant": "claude-code",
    "evidence": ["logs/backblaze-backrest.md", "compose/backblaze-backrest.yml"],
    "what_broke": [
      "Backrest itself booted clean — the verdict is about the job, not the tool",
      "A restic repo pointed at local disk is not a backup, it's a copy; the offsite leg (B2/S3) is where the real monthly cost hides"
    ]
  },
  "compose": "compose/backblaze-backrest.yml",
  "links": {
    "caniselfhostit": "https://caniselfhostit.com/backblaze-personal-backup"
  },
  "notes": "Self-host backups OF your self-hosted stack (Backrest is great for that — it's in our own reference stack). Replacing the offsite last-resort copy of your family photos is a different question, and the honest answer is no."
}
