{
  "id": "inoreader",
  "name": "Inoreader",
  "domain": "inoreader.com",
  "category": "reading-bookmarks",
  "price_usd_mo": 9.99,
  "price_plan": "Pro",
  "price_unit": "flat",
  "price_source": "https://www.inoreader.com/pricing",
  "price_checked": "2026-08-07",
  "links": {
    "caniselfhostit": "https://caniselfhostit.com/inoreader"
  },
  "jobs": [
    "follow feeds",
    "read-state sync",
    "keyboard-driven reading",
    "integrations (save to wallabag/pocket-likes)"
  ],
  "verdict": "YES",
  "alternatives": [
    "miniflux",
    "freshrss"
  ],
  "provenance": {
    "capability_seed": "caniselfhostit",
    "decision_layer": "original"
  },
  "verdict_reason": "Miniflux is 20MB of Go that does the reading part of a $120/yr subscription. Bring your own opinions about minimalism.",
  "what_you_lose": [
    "Inoreader's rules/automation engine and article monitoring",
    "Fancy dashboards — Miniflux is deliberately plain"
  ],
  "economics": {
    "vps_share_usd_mo": 0.8,
    "storage_usd_mo": 0,
    "maint_min_mo": 10
  },
  "hardware_tier": "pi",
  "verified": {
    "by": "zernonia",
    "at": "2026-08-10",
    "protocol": "v1",
    "setup_min": 35,
    "assistant": "claude-code",
    "evidence": [
      "logs/inoreader-miniflux.md",
      "compose/inoreader-miniflux.yml"
    ],
    "what_broke": [
      "CREATE_ADMIN only fires on first boot; set the env before, not after, or exec the CLI"
    ]
  },
  "compose": "compose/inoreader-miniflux.yml"
}
